HSCode,Commodity,Year_2022_2023,Share_Percentage_22_23,Year_2023_2024,Share_Percentage_23_24
100111,DURUM WHEAT: SEED,4.91,0,0,0
100119,OTHER DURUM WHEAT EXCL SEED,29.41,0,0,0
100191,WHEAT AND MESLIN SEED EXCL. DURUM WHEAT,107.73,0,0.12,0
100199,OTHER WHEAT AND MESLIN,"46,941.02",0.013,94.27,0.0003
100210,RYE -SEED,3.16,0,0,0
100290,RYE- OTHER EXCL SEED,1.02,0,0,0
100310,BARLEY SEED,194.32,0.0001,19.82,0.0001
100390,OTHER BARLEY EXCL SEED,"1,901.64",0.0005,211.54,0.0007
100410,OATS SEED,11.85,0,0,0
100490,OTHER OATS EXCL SEED,515.79,0.0001,48.42,0.0002
100510,MAIZE SEED,"47,550.43",0.0131,"4,723.80",0.0162
100590,OTHER MAIZE (CORN),"318,459.14",0.088,"9,341.12",0.0321
100610,RICE IN HUSK (PADDY OR ROUGH),"101,112.47",0.0279,"6,773.19",0.0233
100620,HUSKED (BROWN) RICE,"107,778.82",0.0298,"9,463.14",0.0325
100630,SEMI/WHOLLY MILED RICE W/N POLISHED/GLAZED,"8,250,262.88",2.2795,"759,398.77",2.6117
100640,BROKEN RICE,"160,212.21",0.0443,"18,441.70",0.0634
100710,GRAIN SORGHUM SEED,"6,828.67",0.0019,261.4,0.0009
100790,OTHER GRAIN SORGHUM EXCL SEED,"7,631.80",0.0021,577.04,0.002
100810,BUCK WHEAT,503.67,0.0001,22.05,0.0001
100821,MILLET : SEED,"5,359.65",0.0015,771.89,0.0027
100829,OTHER MILLET EXCL SEED,"28,529.43",0.0079,"1,684.24",0.0058
100830,CANARY SEED,262.21,0.0001,28.55,0.0001
100850,CANNARY SEEDS-QUINOA(CHENOPODIUM QUINOA),"2,307.07",0.0006,352,0.0012
100860,CANNARY SEEDS-TRITICALE,0.85,0,0,0
100890,OTHER CEREALS :,"9,657.02",0.0027,827.01,0.0028
10,CEREALS.,"9,096,167.17",2.5132,"813,040.06",2.7961
1,LIVE ANIMALS.,"10,246.96",0.0028,"1,640.34",0.0056
2,MEAT AND EDIBLE MEAT OFFAL.,"3,174,669.89",0.8772,"218,482.12",0.7514
3,"FISH AND CRUSTACEANS, MOLLUSCS AND OTHER AQUATIC INVERTABRATES.","5,071,041.86",1.4011,"354,261.75",1.2183
4,"DAIRY PRODUCE; BIRDS' EGGS; NATURAL HONEY; EDIBLE PROD. OF ANIMAL ORIGIN, NOT ELSEWHERE SPEC. OR INCLUDED.","517,436.08",0.143,"45,391.21",0.1561
5,"PRODUCTS OF ANIMAL ORIGIN, NOT ELSEWHERE SPECIFIED OR INCLUDED.","222,725.13",0.0615,"9,167.98",0.0315
6,LIVE TREES AND OTHER PLANTS; BULBS; ROOTS AND THE LIKE; CUT FLOWERS AND ORNAMENTAL FOLIAGE.,"71,782.88",0.0198,"5,814.78",0.02
7,EDIBLE VEGETABLES AND CERTAIN ROOTS AND TUBERS.,"1,606,670.21",0.4439,"131,715.67",0.453
8,EDIBLE FRUIT AND NUTS; PEEL OR CITRUS FRUIT OR MELONS.,"1,355,788.69",0.3746,"126,818.70",0.4361
9,"COFFEE, TEA, MATE AND SPICES.","3,922,976.27",1.0839,"395,308.40",1.3595
10,CEREALS.,"9,096,167.17",2.5132,"813,040.06",2.7961
11,PRODUCTS OF THE MILLING INDUSTRY; MALT; STARCHES; INULIN; WHEAT GLUTEN.,"596,835.05",0.1649,"58,460.84",0.2011
12,"OIL SEEDS AND OLEA. FRUITS; MISC. GRAINS, SEEDS AND FRUIT; INDUSTRIAL OR MEDICINAL PLANTS; STRAW AND FODDER.","1,774,620.01",0.4903,"143,013.57",0.4918
13,"LAC; GUMS, RESINS AND OTHER VEGETABLE SAPS AND EXTRACTS.","805,378.60",0.2225,"67,435.16",0.2319
14,VEGETABLE PLAITING MATERIALS; VEGETABLE PRODUCTS NOT ELSEWHERE SPECIFIED OR INCLUDED.,"37,878.79",0.0105,"3,718.92",0.0128
15,ANIMAL OR VEGETABLE FATS AND OILS AND THEIR CLEAVAGE PRODUCTS; PRE. EDIBLE FATS; ANIMAL OR VEGETABLE WAXEX.,"1,511,048.01",0.4175,"147,239.90",0.5064
16,"PREPARATIONS OF MEAT, OF FISH OR OF CRUSTACEANS, MOLLUSCS OR OTHER AQUATIC INVERTEBRATES","600,929.83",0.166,"39,615.04",0.1362
17,SUGARS AND SUGAR CONFECTIONERY.,"2,725,578.38",0.7531,"206,998.80",0.7119
18,COCOA AND COCOA PREPARATIONS.,"152,194.50",0.0421,"14,261.76",0.049
19,"PREPARATIONS OF CEREALS, FLOUR, STARCH OR MILK; PASTRYCOOKS PRODUCTS.","679,849.26",0.1878,"56,025.56",0.1927
20,"PREPARATIONS OF VEGETABLES, FRUIT, NUTS OR OTHER PARTS OF PLANTS.","957,455.83",0.2645,"73,130.64",0.2515
21,MISCELLANEOUS EDIBLE PREPARATIONS.,"1,216,405.64",0.3361,"96,507.78",0.3319
22,"BEVERAGES, SPIRITS AND VINEGAR.","373,890.03",0.1033,"30,861.35",0.1061
23,RESIDUES AND WASTE FROM THE FOOD INDUSTRIES; PREPARED ANIMAL FODER.,"2,304,110.93",0.6366,"167,469.28",0.5759
24,TOBACCO AND MANUFACTURED TOBACCO SUBSTITUTES.,"1,200,589.41",0.3317,"99,008.79",0.3405
25,"SALT; SULPHUR; EARTHS AND STONE; PLASTERING MATERIALS, LIME AND CEMENT.","1,837,865.06",0.5078,"158,031.38",0.5435
26,"ORES, SLAG AND ASH.","3,535,638.94",0.9769,"141,073.43",0.4852
27,"MINERAL FUELS, MINERAL OILS AND PRODUCTS OF THEIR DISTILLATION; BITUMINOUS SUBSTANCES; MINERAL WAXES.","72,540,760.81",20.0428,"5,750,622.82",19.777
28,"INORGANIC CHEMICALS; ORGANIC OR INORGANIC COMPOUNDS OF PRECIOUS METALS, OF RARE-EARTH METALS, OR RADI. ELEM. OR OF ISOTOPES.","2,655,139.07",0.7336,"164,103.73",0.5644
29,ORGANIC CHEMICALS,"16,817,254.84",4.6466,"1,446,334.01",4.9741
30,PHARMACEUTICAL PRODUCTS,"18,304,878.07",5.0576,"1,669,823.96",5.7427
31,FERTILISERS.,"107,737.69",0.0298,"8,634.18",0.0297
32,"TANNING OR DYEING EXTRACTS; TANNINS AND THEIR DERI. DYES, PIGMENTS AND OTHER COLOURING MATTER; PAINTS AND VER; PUTTY AND OTHER MASTICS; INKS.","3,299,723.86",0.9117,"272,899.54",0.9385
33,"ESSENTIAL OILS AND RESINOIDS; PERFUMERY, COSMETIC OR TOILET PREPARATIONS.","2,453,055.10",0.6778,"209,428.17",0.7202
34,"SOAP, ORGANIC SURFACE-ACTIVE AGENTS, WASHING PREPARATIONS, LUBRICATING PREPARATIONS, ARTIFICIAL WAXES, PREPARED WAXES, POLISHING OR SCOURING PREP.","824,175.19",0.2277,"65,487.67",0.2252
35,ALBUMINOIDAL SUBSTANCES; MODIFIED STARCHES; GLUES; ENZYMES.,"313,070.98",0.0865,"27,339.67",0.094
36,EXPLOSIVES; PYROTECHNIC PRODUCTS; MATCHES; PYROPHORIC ALLOYS; CERTAIN COMBUSTIBLE PREPARATIONS.,"229,095.75",0.0633,"20,678.10",0.0711
37,PHOTOGRAPHIC OR CINEMATOGRAPHIC GOODS.,"12,475.88",0.0034,804.8,0.0028
38,MISCELLANEOUS CHEMICAL PRODUCTS.,"5,445,453.35",1.5046,"429,934.07",1.4786
39,PLASTIC AND ARTICLES THEREOF.,"6,111,704.65",1.6886,"509,623.08",1.7526
40,RUBBER AND ARTICLES THEREOF.,"3,789,020.84",1.0469,"325,654.50",1.12
41,RAW HIDES AND SKINS (OTHER THAN FURSKINS) AND LEATHER,"371,486.73",0.1026,"33,172.87",0.1141
42,"ARTICLES OF LEATHER,SADDLERY AND HARNESS;TRAVEL GOODS, HANDBAGS AND SIMILAR CONT.ARTICLES OF ANIMAL GUT(OTHR THN SILK-WRM)GUT.","2,025,611.79",0.5597,"153,810.23",0.529
43,"FURSKINS AND ARTIFICIAL FUR, MANUFACTURES THEREOF.","9,819.18",0.0027,553.78,0.0019
44,WOOD AND ARTICLES OF WOOD; WOOD CHARCOAL.,"513,981.78",0.142,"37,961.10",0.1306
45,CORK AND ARTICLES OF CORK.,"4,379.51",0.0012,305.48,0.0011
46,"MANUFACTURES OF STRAW, OF ESPARTO OR OF OTHER PLAITING MATERIALS; BASKETWARE AND WICKERWORK.","56,946.52",0.0157,"4,363.87",0.015
47,PULP OF WOOD OR OF OTHER FIBROUS CELLULOSIC MATERIAL; WASTE AND SCRAP OF PAPER OR PAPERBOARD.,"7,358.35",0.002,674.59,0.0023
48,"PAPER AND PAPERBOARD; ARTICLES OF PAPER PULP, OF PAPER OR OF PAPERBOARD.","2,172,777.53",0.6003,"171,757.63",0.5907
49,"PRINTED BOOKDS, NEWSPAPERS, PICTURES AND OTHER PRODUCTS OF THE PRINTING INDUSTRY; MANUSCRIPTS, TYPESCRIPTS AND PLANS.","356,082.67",0.0984,"34,012.45",0.117
50,SILK,"102,735.53",0.0284,"11,177.69",0.0384
51,"WOOL, FINE OR COARSE ANIMAL HAIR, HORSEHAIR YARN AND WOVEN FABRIC.","136,830.52",0.0378,"9,018.93",0.031
52,COTTON.,"5,614,548.90",1.5513,"451,474.76",1.5527
53,OTHER VEGETABLE TEXTILE FIBRES; PAPER YARN AND WOVEN FABRICS OF PAPER YARN.,"391,851.53",0.1083,"41,304.32",0.142
54,MAN-MADE FILAMENTS.,"1,457,640.87",0.4027,"115,851.96",0.3984
55,MAN-MADE STAPLE FIBRES.,"1,356,920.97",0.3749,"112,544.66",0.3871
56,"WADDING, FELT AND NONWOVENS; SPACIAL YARNS; TWINE, CORDAGE, ROPES AND CABLES AND ARTICLES THEREOF.","476,032.55",0.1315,"40,874.25",0.1406
57,CARPETS AND OTHER TEXTILE FLOOR COVERINGS.,"1,553,046.77",0.4291,"127,762.83",0.4394
58,SPECIAL WOVEN FABRICS; TUFTED TEXTILE FABRICS; LACE; TAPESTRIES; TRIMMINGS; EMBROIDERY.,"297,978.19",0.0823,"24,099.39",0.0829
59,"IMPREGNATED, COATED, COVERED OR LAMINATED TEXTILE FABRICS; TEXTILE ARTICLES OF A KIND SUITABLE FOR INDUSTRIAL USE.","396,928.62",0.1097,"33,555.59",0.1154
60,KNITTED OR CROCHETED FABRICS.,"390,925.06",0.108,"35,993.68",0.1238
61,"ARTICLES OF APPAREL AND CLOTHING ACCESSORIES, KNITTED OR CORCHETED.","5,579,809.79",1.5417,"445,654.99",1.5327
62,"ARTICLES OF APPAREL AND CLOTHING ACCESSORIES, NOT KNITTED OR CROCHETED.","6,461,282.42",1.7852,"555,641.41",1.9109
63,OTHER MADE UP TEXTILE ARTICLES; SETS; WORN CLOTHING AND WORN TEXTILE ARTICLES; RAGS,"4,625,032.95",1.2779,"371,737.82",1.2784
64,"FOOTWEAR, GAITERS AND THE LIKE; PARTS OF SUCH ARTICLES.","2,060,833.23",0.5694,"141,482.72",0.4866
65,HEADGEAR AND PARTS THEREOF.,"79,650.10",0.022,"5,044.32",0.0173
66,"UMBRELLAS, SUN UMBRELLAS, WALKING-STICKS, SEAT-STICKS, WHIPS,RIDING-CROPS AND PARTS THEREOF.","3,745.40",0.001,457.1,0.0016
67,PREPARED FEATHERS AND DOWN AND ARTICLES MADE OF FEATHERS OR OF DOWN; ARTIFICIAL FLOWERS; ARTICLES OF HUMAN HAIR.,"486,709.41",0.1345,"37,939.57",0.1305
68,"ARTICLES OF STONE, PLASTER, CEMENT, ASBESTOS, MICA OR SIMILAR MATERIALS.","1,715,514.03",0.474,"142,884.32",0.4914
69,CERAMIC PRODUCTS.,"2,523,620.94",0.6973,"202,103.35",0.6951
70,GLASS AND GLASSWARE.,"914,528.34",0.2527,"73,977.45",0.2544
71,"NATURAL OR CULTURED PEARLS,PRECIOUS OR SEMIPRECIOUS STONES,PRE.METALS,CLAD WITH PRE.METAL AND ARTCLS THEREOF;IMIT.JEWLRY;COIN.","27,209,729.13",7.518,"1,892,253.62",6.5077
72,IRON AND STEEL,"9,811,777.34",2.711,"703,775.95",2.4204
73,ARTICLES OF IRON OR STEEL,"8,229,052.44",2.2737,"612,302.16",2.1058
74,COPPER AND ARTICLES THEREOF.,"1,917,237.04",0.5297,"94,426.83",0.3247
75,NICKEL AND ARTICLES THEREOF.,"136,679.04",0.0378,"10,917.24",0.0375
76,ALUMINIUM AND ARTICLES THEREOF.,"6,334,654.30",1.7502,"439,947.45",1.513
78,LEAD AND ARTICLES THEREOF.,"647,005.75",0.1788,"52,659.65",0.1811
79,ZINC AND ARTICLES THEREOF.,"601,774.25",0.1663,"55,591.44",0.1912
80,TIN AND ARTICLES THEREOF.,"13,746.31",0.0038,"1,147.38",0.0039
81,OTHER BASE METALS; CERMETS; ARTICLES THEREOF.,"83,903.45",0.0232,"7,282.89",0.025
82,"TOOLS IMPLEMENTS, CUTLERY, SPOONS AND FORKS, OF BASE METAL; PARTS THEREOF OF BASE METAL.","873,900.34",0.2415,"73,294.61",0.2521
83,MISCELLANEOUS ARTICLES OF BASE METAL.,"730,132.76",0.2017,"57,575.00",0.198
84,"NUCLEAR REACTORS, BOILERS, MACHINERY AND MECHANICAL APPLIANCES; PARTS THEREOF.","24,886,594.84",6.8761,"2,115,537.67",7.2756
85,"ELECTRICAL MACHINERY AND EQUIPMENT AND PARTS THEREOF; SOUND RECORDERS AND REPRODUCERS, TELEVISION IMAGE AND SOUND RECORDERS AND REPRODUCERS,AND PARTS.","28,497,039.16",7.8737,"2,514,147.32",8.6464
86,"RAILWAY OR TRAMWAY LOCOMOTIVES, ROLLING-STOCK AND PARTS THEREOF; RAILWAY OR TRAMWAY TRACK FIXTURES AND FITTINGS AND PARTS THEREOF; MECHANICAL","260,991.29",0.0721,"25,990.44",0.0894
87,"VEHICLES OTHER THAN RAILWAY OR TRAMWAY ROLLING STOCK, AND PARTS AND ACCESSORIES THEREOF.","17,294,539.38",4.7784,"1,369,712.52",4.7106
88,"AIRCRAFT, SPACECRAFT, AND PARTS THEREOF.","2,690,956.06",0.7435,"234,109.84",0.8051
89,"SHIPS, BOATS AND FLOATING STRUCTURES.","3,359,479.71",0.9282,"221,150.13",0.7606
90,"OPTICAL, PHOTOGRAPHIC CINEMATOGRAPHIC MEASURING, CHECKING PRECISION, MEDICAL OR SURGICAL INST. AND APPARATUS PARTS AND ACCESSORIES THEREOF;","4,131,415.59",1.1415,"306,661.39",1.0546
91,CLOCKS AND WATCHES AND PARTS THEREOF.,"76,241.95",0.0211,"3,628.52",0.0125
92,MUSICAL INSTRUMENTS; PARTS AND ACCESSORIES OF SUCH ARTICLES.,"37,537.27",0.0104,"3,123.46",0.0107
93,ARMS AND AMMUNITION; PARTS AND ACCESSORIES THEREOF.,"286,368.96",0.0791,"102,712.92",0.3532
94,"FURNITURE; BEDDING, MATTRESSES, MATTRESS SUPPORTS, CUSHIONS AND SIMILAR STUFFED FURNISHING; LAMPS AND LIGHTING FITTINGS NOT ELSEWHERE SPECIFIED OR INC","2,001,146.60",0.5529,"156,465.19",0.5381
95,"TOYS, GAMES AND SPORTS REQUISITES; PARTS AND ACCESSORIES THEREOF.","432,954.15",0.1196,"28,483.50",0.098
96,MISCELLANEOUS MANUFACTURED ARTICLES.,"598,767.01",0.1654,"49,915.87",0.1717
97,WORKS OF ART COLLECTORS' PIECES AND ANTIQUES.,"279,345.11",0.0772,"5,754.47",0.0198
98,PROJECT GOODS; SOME SPECIAL USES.,"20,532.21",0.0057,"1,461.14",0.005
99,MISCELLANEOUS GOODS.,"77,755.41",0.0215,"14,259.79",0.049
10129,OTHER HORSES EXCL FOR PURE BREED BREEDING,7.86,0,23.14,0.0001
10190,"LIVE HORSES,ASSES,MULES AND HINNIES OTHER",0.1,0,0,0
10231,PURE-BRED BREEDING BUFFALOES,183.31,0.0001,0,0
10290,LIVE BOVNE ANMLS OTHR CATTLE AND BUFFALO,24.91,0,0,0
10410,LIVE SHEEP,"1,119.19",0.0003,239.14,0.0008
10420,LIVE GOATS,"8,091.76",0.0022,"1,330.59",0.0046
10511,FOWLS OF THE SPECIES GALLUS DOMESTICUS WT<=185 G,645.56,0.0002,30.45,0.0001
10594,FOWLS OF THE SPECIES GALLUS DOMESTICUS OTH THAN OF HEADING 01051100,47.58,0,6.72,0
10599,OTHER LIVE POULTRY WEIGHING > 185G,122.95,0,10.29,0
10619,OTHER MAMMALS,0.18,0,0,0
10690,"OTHER LIVE ANIMALS EXCLUDING MAMMALS, REPTILES AND BIRDS",3.56,0,0,0
1,LIVE ANIMALS.,"10,246.96",0.0028,"1,640.34",0.0056
20110,"CRCS AND HLF-CRCS OF BOVN ANMLS,FRSH OR CHLD",3.13,0,0,0
20130,BONELESS,"104,722.59",0.0289,"8,650.76",0.0298
20210,"CRCS HALF-CRCS OF BOVN ANMLS, FROZEN",204.83,0.0001,0,0
20220,OTHER CUTS WITH BONE IN,73.11,0,0,0
20230,BONELESS,"2,786,220.87",0.7698,"187,426.47",0.6446
20311,"CRCS AND HLF CRCS SWINE MEAT,FRESH OR CHLD",632.32,0.0002,0,0
20312,"HAMS, SHOULDERS AND CUTS THEREOF, WITH BONE IN",42.3,0,0,0
20329,"OTHER MEAT OF SWINE, FROZEN",2.93,0,0,0
20410,"CRCS AND HALF-CRCS OF LAMB, FRSH OR CHLD","12,263.16",0.0034,"1,287.64",0.0044
20421,"CRCS AND HLF CRCS OF SHEEP,FRSH OR CHLD","48,562.27",0.0134,"5,643.23",0.0194
20423,BONELESS,,0,41.39,0.0001
20430,"CARCASSES AND HALF-CARCASSES OF LAMB, FROZEN",2.06,0,0,0
20441,CARCASSES AND HALF-CARCASSES,"1,668.07",0.0005,111.49,0.0004
20442,OTHER CUTS WITH BONE IN,"1,128.74",0.0003,175.19,0.0006
20443,BONELESS,2.12,0,36.14,0.0001
20450,MEAT OF GOATS,578.36,0.0002,36.75,0.0001
20610,"EDBL OFFAL OF BOVINE ANMLS,FRSH/CHILLED","2,549.03",0.0007,177.12,0.0006
20621,"EDIBLE TONGUES OF BOVINE ANIMALS, FROZEN","5,081.33",0.0014,418.6,0.0014
20622,"EDIBLE LIVERS OF BOVINE ANIMALS, FROZEN","9,691.60",0.0027,833.99,0.0029
20629,"OTHR EDIBLE OFFAL OF BOVINE ANIMALS,FROZEN","192,145.36",0.0531,"12,789.46",0.044
20680,"OTHER, FRESH OR CHILLED :",150.26,0,14.27,0
20690,"OTHER, FROZEN :",310.9,0.0001,0,0
20711,"MEAT/EDBL OFAL OF FOWLS OF THE SPCS GALS DOMESTICUS NOT CUT IN PIECES,FRES/CHILLED",20.79,0,0,0
20712,"MEAT/EDBL OFAL OF FOWLSOF THE SPCS GALS DOMESTICUS NOT CUT IN PIECES,FROZEN","6,081.73",0.0017,589.9,0.002
20713,"CUTS AND OFFAL, FRESH OR CHILLED",32.5,0,0,0
20714,"CUTS AND OFFAL, FROZEN","2,183.91",0.0006,249.71,0.0009
20727,"CUTS AND OFFAL, FROZEN",1.4,0,0,0
20745,"OTHER DUCKS, FROZEN",1.72,0,0,0
20755,"OTHER GEESE, FROZEN",52.05,0,0,0
21012,BELLIES (STREAKY) AND CUTS THEREOF,1.1,0,0,0
21019,"OTHR MEAT OF SWINE,SLTD,IN BRINE,DRD/SMKD",0.69,0,0,0
21020,MEAT OF BOVINE ANIMALS,6.85,0,0,0
21099,OTHER,251.81,0.0001,,
2,MEAT AND EDIBLE MEAT OFFAL.,"3,174,669.89",0.8772,"218,482.12",0.7514
90111,COFFEE NEITHER ROASTED NOR DECAFFEINATED,"676,530.79",0.1869,"83,005.39",0.2855
90112,NOT ROASTED BUT DECAFFEINATED COFFEE,653.53,0.0002,6.51,0
90121,ROASTED NOT DECAFFEINATED COFFEE,"2,205.26",0.0006,163.75,0.0006
90122,ROASTED DECAFFEINATED COFFEE,107.15,0,1.31,0
90190,OTHER COFFEE,"1,735.92",0.0005,206.06,0.0007
90210,GREEN TEA IN PACKETS NT EXCDNG 3 KG,"6,972.34",0.0019,688.87,0.0024
90220,OTHER GREEN TEA (NOT FERMENTED):,"11,545.21",0.0032,673.29,0.0023
90230,BLACK TEA(FRMNTD) AND PRTLY FRMNTD TEA IN IMMDTE PACKNG OF A CONTNT NOT EXCDNG 3 KG,"80,924.13",0.0224,"7,513.84",0.0258
90240,OTHER BLACK TEA (FERMENTED) AND OTHER PARTLY FERMENTED TEA :,"516,097.39",0.1426,"36,135.92",0.1243
90300,MATE,10.19,0,,
90411,PEPPER NEITHER CRUSHED NOR GROUND,"36,457.84",0.0101,"3,575.23",0.0123
90412,CRUSHED OR GROUND PEPPER,"35,636.32",0.0098,"2,800.28",0.0096
90421,"FRUITS OF THE GENUS CAPSICUM OR OF THE GENUS PIMENTA: DRIED, NEITHER CRUSHED NOR GROUND:","954,091.82",0.2636,"62,230.31",0.214
90422,FRUITS OF THE GENUS CAPSICUM- CRUSHED OR GROUND,"238,737.67",0.066,"19,002.15",0.0654
90520,VANILLA- CRUSHED OR GROUND,347.57,0.0001,2.96,0
90611,CINNAMON (CINNAMOMUM ZEYLANICUM BLUME),"4,153.99",0.0011,350.52,0.0012
90619,OTHER:,"2,400.94",0.0007,112.22,0.0004
90620,CINNAMON AND ITS TREE FLWRS CRSHD OR GRND,"3,671.89",0.001,425.84,0.0015
90710,"CLOVES (WHOLE FRUIT, CLOVES AND STEMS) NEITHER CRUSHED NOR GROUND","8,514.14",0.0024,883.85,0.003
90720,"CLOVES (WHOLE FRUIT, CLOVES AND STEMS) CRUSHED OR GROUND","1,469.64",0.0004,189.22,0.0007
90811,NUTMEG NEITHER CRUSHED NOR GROUND,"21,189.56",0.0059,"1,367.67",0.0047
90812,NUTMEG CRUSHED OR GROUND,"5,842.70",0.0016,537.11,0.0018
90821,MACE NEITHER CRUSHED NOR GROUND,"1,090.73",0.0003,114.34,0.0004
90822,MACE CRUSHED OR GROUND,564.7,0.0002,36.11,0.0001
90831,CARDAMOMS: NEITHER CRUSHED NOR GROUND:,"109,439.49",0.0302,"12,897.49",0.0444
90832,CARDAMOMS: CRUSHED OR GROUND,"5,530.23",0.0015,614.04,0.0021
90921,SEEDS OF CORIANDER:NEITHER CRUSHED NOR GROUND:,"77,333.33",0.0214,"4,894.87",0.0168
90922,SEEDS OF CORIANDER:CRUSHED OR GROUND,"17,487.64",0.0048,"1,268.34",0.0044
90931,SEEDS OF CUMIN: NEITHER CRUSHED NOR GROUND,"527,945.50",0.1459,"96,270.30",0.3311
90932,SEEDS OF CUMIN: CRUSHED OR GROUND,"51,777.93",0.0143,"4,010.33",0.0138
90961,"SEEDS OF ANISE, BADIAN, CARAWAY OR FENNEL; JUNIPER BERRIES NEITHER CRUSHED NOR GROUND","63,848.43",0.0176,"11,615.58",0.0399
90962,"SEEDS OF ANISE, BADIAN, CARAWAY OR FENNEL; JUNIPER BERRIES CRUSHED OR GROUND","5,768.06",0.0016,195.87,0.0007
91011,GINGER:NEITHER CRUSHED NOR GROUND,"46,317.02",0.0128,"2,811.88",0.0097
91012,GINGER:CRUSHED OR GROUND,"18,371.54",0.0051,"1,601.36",0.0055
91020,SAFFRON,584.5,0.0002,52.4,0.0002
91030,TURMERIC (CURCUMA),"187,586.79",0.0518,"21,760.08",0.0748
91091,MIXTRS OF TWO OR MORS PRODCTS OF DIFF HDG,"89,605.15",0.0248,"6,661.84",0.0229
91099,OTHER : SEED :,"110,429.23",0.0305,"10,631.26",0.0366
9,"COFFEE, TEA, MATE AND SPICES.","3,922,976.27",1.0839,"395,308.40",1.3595
170112,BEET SUGR RAW NT CONTNG FLVRNG/COLRNG MATR,116.55,0,15.24,0.0001
170113,CANE SUGAR SPECIFIED IN SUBHEADING NOTE 2 TO THIS CHAPTER:,"56,381.70",0.0156,"4,173.90",0.0144
170114,OTHER CANE SUGAR:,"493,967.01",0.1365,"38,651.73",0.1329
170191,SUGR REFIND CONTNG FLVRNG OR CLRNG MATTER,"5,866.79",0.0016,14.36,0
170199,SUGR REFIND NT CONTNG FRVRNG/COLRNG MATTER,"1,741,027.42",0.481,"137,150.16",0.4717
170211,LACTS AND LACTS SYRP CONTNG 99% OR MRE LACTSCALCTD ON THE DRY MATTER,"7,598.57",0.0021,596.51,0.0021
170219,OTHER LACTOSE AND LACTOSE SYRUP,252.04,0.0001,2.67,0
170220,MAPLE SUGAR AND MAPLE SYRUP,9.14,0,0.42,0
170230,CHMCLY PURE GLUCOS AND ITS SYRP WITHOUT OR WITH < 20% BY WGT OF FRACTOS IN DRY STATE,"81,495.47",0.0225,"5,972.20",0.0205
170240,CHMCLY PURE GLUCS AND GLUCS SYRP IN DRY STATE WITH FRUCTOSE CONTENT AT LEAST 20% BUT LESS THAN 50%,316.42,0.0001,65.11,0.0002
170250,CHEMICALLY PURE FRUCTOSE IN SOLID FORM,9.07,0,2.22,0
170260,"OTHER FRUCTOSE AND FRUCTOSE SYRUP, CONTAINING IN THE DRY STATE MORE THAN 50% BY WEIGHT OF FRUCTOSE, EXCLUDING INV",11.15,0,0.03,0
170290,"OTHER, INCLUDING INVERT SUGAR AND OTHER SUGAR AND SUGAR SYRUP BLENDS CONTAINING IN THE DRY STATE 50% BY WEIGHT OF FRUC","41,657.79",0.0115,"3,899.81",0.0134
170310,CANE MOLSES RSLTD FRM EXTRCTN/RFNG OF SUGR,"85,556.21",0.0236,615.97,0.0021
170390,OTHR MOLSES RSLTD FRM EXTRCTN/RFNG OF SUGR,"24,697.95",0.0068,964.2,0.0033
170410,CHEWING GUM W/N SUGAR COATED,"11,547.24",0.0032,"1,150.48",0.004
170490,OTHER SUGR CNFCTNRY NT CONTAINING COCOA,"175,067.86",0.0484,"13,723.79",0.0472
17,SUGARS AND SUGAR CONFECTIONERY.,"2,725,578.38",0.7531,"206,998.80",0.7119
310100,"ANML/VGTBL FRTLSRS,W/N MIXED TOGETHER OR CHMCLY TRTD;FERTILISERS PRDCD BY THE MXNG/CHMCL TREATMNT OF ANML/VEGTBL PRDCTS","14,422.06",0.004,"1,648.31",0.0057
310210,UREA WHETHER OR NOT IN AQUEOUS SOLUTION,"25,803.82",0.0071,106.6,0.0004
310221,AMMONIUM SULPHATE,"1,206.52",0.0003,190.28,0.0007
310229,DOUBLE SALTS AND MIXTURES OF AMMONIUM SLPHTE,264.63,0.0001,2.87,0
310230,AMMONIUM NITRATE W/N IN AQUEOUS SOLUTION,427.62,0.0001,928.25,0.0032
310250,SODIUM NITRATE,80.93,0,19.87,0.0001
310260,DOUBLE SLT/MXTR OF CALCM NITRTE/AMONM NTRT,224.01,0.0001,4.07,0
310280,MIXTURES OF UREA AND AMMONIUM NITRATE IN AQUEOUS OR AMMONIACAL SOLUTION,61.58,0,,
310290,"OTHR MNRL/CHMCL FRTLSRS,NTROGNS INCL MXTRSFOREGOING SUB-HEADING",288.51,0.0001,16.08,0.0001
310311,SUPERPHOSPHATES CONTAINING BY WEIGHT 35 % OR MORE OF DIPHOSPHORUS PENTAOXIDE (P2O5),3.15,0,,
310319,OTHER SUPERPHOSPHATES,"18,408.32",0.0051,"3,028.83",0.0104
310420,POTASSIUM CHLORIDE,"9,405.76",0.0026,932.19,0.0032
310430,POTASSIUM SULPHATE,"2,522.86",0.0007,159.36,0.0005
310490,OTHER MINERLS OF CHEMCL FRTLISRS POTSSIC,316.15,0.0001,2.77,0
310510,GOODS OF THIS CHPTER IN TBLETS/SMLR FORMS/IN PACKGS OF A GROSS WT NOT EXCEEDNG 10 KG,305.92,0.0001,302.23,0.001
310520,MINRL/CHEMCL FERTLSRS CONTNG THE THREE FRTLSNG ELMNTS NITROGN PHOSPHRS AND POTASIUM,"11,580.90",0.0032,156.1,0.0005
310530,DIAMONM HYDRGNORTHPHOSPHT(DIAMONM PHOSPHT),"15,556.78",0.0043,649.61,0.0022
310540,AMONM DIHYDROGNORTHOPHOSPHT(MONOAMMONIUM PHOSPHT)/MXTRS THEREOF WITH DIAMMONIUM HYDROGNORTHOPHOSPHT(DIAMMONIUM PHOSP,564.73,0.0002,22.12,0.0001
310551,MNRL/CHMCL FERTLSRS CONTNG NITRTS/PHOSPHTS,48.51,0,2.89,0
310559,OTHR MINRL/CHCML FERTLSRS CONTNG TWO FER-LSNG ELEMNTS NITROGEN AND PHOSPHORUS,4.76,0,0,0
310560,MINRL OR CHMCL FERTLSRS CONTNG THE TWO FERTLSNG ELMNTS PHOSPHORUS AND POTASSIUM,156.73,0,0,0
310590,OTHER MINRL/CHEMCL FERTLSRS,"6,083.45",0.0017,461.75,0.0016
31,FERTILISERS.,"107,737.69",0.0298,"8,634.18",0.0297
80111,COCONUT DESICCATED,6191.01,0.0017,3604.77,0.001
80112,COCONUT IN THE INNER SHELL (ENDOCARP):,10792.3,0.003,17901.21,0.0049
80119,OTHER COCONUTS,28515.11,0.0079,52832.88,0.0146
80121,BRAZIL NUTS FRSH/DRED IN SHELL,6.7,0,18.44,0
80122,BRAZIL NUTS FRSH/DRED SHELLED,5.16,0,3.96,0
80131,CASHEN NUTS FRESH/DRIED IN SHELL,14283.04,0.0039,17839.01,0.0049
80132,CASHEN NUTS FRESH/DRIED SHELLED,272603.34,0.0753,263041.03,0.0727
80211,ALMONDS FRSH OR DRIEDIN SHELL,365.76,0.0001,847.31,0.0002
80212,SHELLED ALMONDS FRSH OR DRIED,910.39,0.0003,928.22,0.0003
80221,"HAZELNUTS IN SHELL,FRSH OR DRIED",20.82,0,32.3,0
80222,"SHELLED HAZELNUTS, FRSH OR DRIED",64.59,0,15.39,0
80231,WALNUTS FRSH OR DRIED IN SHELL,633.49,0.0002,225.88,0.0001
80232,SHELLED WALNUTS FRSH OR DRIED,1949.77,0.0005,1775.81,0.0005
80241,CHESTNUTS (CASTANEA SPP.): IN SHELL,0.14,0,0.13,0
80242,CHESTNUTS (CASTANEA SPP.): SHELLED,25.05,0,66.76,0
80251,PISTACHIOS: IN SHELL,54.22,0,651.6,0.0002
80252,PISTACHIOS: SHELLED,92.24,0,114.11,0
80261,MACADAMIA NUTS: IN SHELL,,,4.11,0
80262,MACADAMIA NUTS:SHELLED,9.81,0,8.14,0
80270,KOLA NUTS (COLA SPP.),0.01,0,0.35,0
80280,ARECA NUTS:,48504.97,0.0134,40012.72,0.0111
80291,PINE NUTS IN SHELL,0.87,0,28.15,0
80292,PINE NUTS SHELLED,0.02,0,1.6,0
80299,OTHERS,1141.62,0.0003,831.75,0.0002
80310,PLANTAINS: FRSH OR DRIED,652.81,0.0002,829.65,0.0002
80390,BANANAS FRSH OR DRIED,141919.62,0.0392,242247.96,0.0669
80410,DATES FRESH OR DRIED,1824.53,0.0005,2137.05,0.0006
80420,FIGS FRESH OR DRIED,377.99,0.0001,605.96,0.0002
80430,PINEAPPLES FRESH OR DRIED,3516.76,0.001,3957.65,0.0011
80440,AVOCADOS FRESH OR DRIED,50.64,0,30.92,0
80450,"GUAVAS,MANGOES/MANGOSTEENS FRESH OR DRIED",175842.46,0.0486,125611.46,0.0347
80510,ORANGES FRESH OR DRIED,16852.36,0.0047,16936.47,0.0047
80521,MANDARINS (INCLUDING TANGERINES AND SATSUMAS),191.98,0.0001,10.59,0
80529,OTHER WILKINGS AND SIMILAR CITRUS HYBRIDS,365.25,0.0001,262.25,0.0001
80540,GRAPEFRUIT AND POMELOS,38.54,0,5.06,0
80550,LEMONS(CITRUS LIMON CITRUS LIMONUM) AND LIMES(CITRUS AURANTIFOLIA) FRSH OR DRIED,4612.11,0.0013,3715.45,0.001
80590,OTHER CITRUS FRUITS FRESH OR DRIED,510.09,0.0001,1429,0.0004
80610,GRAPES FRESH,254793.39,0.0704,346070.22,0.0956
80620,GRAPES DRIED,28130.6,0.0078,53466.13,0.0148
80711,WATER MELONS,8447.74,0.0023,10741.48,0.003
80719,"MELON , OTHER THAN WATER MELON",2812.36,0.0008,3236.03,0.0009
80720,PAPAWS (PAPAYAS) FRESH,2777.78,0.0008,3105.32,0.0009
80810,APPLES FRSH,16766.87,0.0046,7717.3,0.0021
80830,PEARS- FRESH,277.8,0.0001,360.19,0.0001
80840,QUINCES- FRESH,0.02,0,2.14,0
80910,APRICOTS FRESH,8.54,0,2.65,0
80921,SOUR CHERRIES (PRUNUS CERASUS),0.08,0,0.09,0
80929,OTHER - CHERRIES:,3.85,0,4.19,0
80930,PEACHES INCL NECTARINES FRESH,9.11,0,42.4,0
80940,"PLUMS AND SLOES , FRESH",101.38,0,113.6,0
81010,STRAWBERRIES FRESH,30.94,0,38.72,0
81020,"RASPBERIS,BLACKBRS,MULBRS AND LOGANBRS,FRSH",158.44,0,196.34,0.0001
81030,"BLACK, WHITE OR RED CURRANTS AND GOOSEBERRIES- FRESH",176.43,0,199.86,0.0001
81040,"CRNBERY BILBERS AND OTHR OF GNUS VCINUM,FRSH",154.48,0,708.72,0.0002
81050,KIWI FRUIT,105.16,0,313.65,0.0001
81060,DURIANS,1.91,0,48.87,0
81070,PERSIMMONS- FRESH,13.28,0,9.11,0
81090,OTHER FRESH FRUITS,57471.58,0.0159,69364.43,0.0192
81110,"STRAWBERS,UNCOOKD/COOKD BY STEMNG/BOLNG IN WATER,FRZN,W/N CONTAINING ADDED SUGAR OR WTHER SWEETENING MATTER",671.91,0.0002,689.66,0.0002
81120,"RASPBERS,BLACK BERS,MULBERS,LOGANBERS, BLCK,WHTE,/RED CURRANTS AND GOOSEBRS,FRZN",408.25,0.0001,442.52,0.0001
81190,"OTHER FRUITS AND NUTS,UNCKD/CKD BY STMNG OR BOILING,FRZN,W/N WITH ADDED SUGR/SWTNG MTR",31943.38,0.0088,35051.59,0.0097
81210,CHERRIES PROVSNLY PRSVD,24.11,0,4.59,0
81290,OTHER FRUITS AND NUTS PROVSNLY PRSVD,410.59,0.0001,421.09,0.0001
81310,"APRICOTS, DRIED",211.73,0.0001,334.88,0.0001
81320,PRUNES DRIED,153.37,0,74.79,0
81330,APPLES DRIED,131.52,0,47.57,0
81340,OTHER FRUIT:,24872.86,0.0069,23843.6,0.0066
81350,MIXTURES OF NUTS OR DRIED FRUITS,218.28,0.0001,358.64,0.0001
81400,"PEEL OF CITRS FRUIT/MELNS(INCL WTRMELNS), FRSH,FRZN,DRIED/PROVSNLY PRSVD IN BRINE, INSULPHUR WTR OR IN OTHR PRSVTV SOLN",120.03,0,213.25,0.0001
8,EDIBLE FRUIT AND NUTS,PEEL OR CITRUS FRUIT OR MELONS.,1164333.35,0.3215,1355788.69